{
  "schema_version": "daily-sales-data-package/v1.3",
  "data_builder_version": "v1.3",
  "date": "2026-05-25",
  "brt_window": {
    "start_utc": "2026-05-25T03:00:00+00:00",
    "end_utc": "2026-05-26T03:00:00+00:00",
    "display": "00:00–23:59 BRT",
    "timezone": "America/Sao_Paulo"
  },
  "generated_at_utc": "2026-05-26T09:50:26.956223+00:00",
  "data_readiness": {
    "status": "DADOS_OK",
    "data_quality": "ok",
    "checks": [
      {
        "check": "timezone_brt",
        "status": "ok",
        "detail": "BRT window: 2026-05-25T03:00:00+00:00 to 2026-05-26T03:00:00+00:00"
      },
      {
        "check": "canonical_source_available",
        "status": "ok",
        "detail": "Found: ['amazon', 'ml', 'shopee']; Missing: []"
      },
      {
        "check": "shopee_separated_by_shop_id",
        "status": "ok",
        "detail": "shop_ids found: ['442066454', '448649947', '860803675']; all 3 present: True"
      },
      {
        "check": "volume_band_shopee-budamix-store",
        "status": "ok",
        "detail": "Orders 72 vs avg30 65.1 = +10.6%"
      },
      {
        "check": "volume_band_shopee-budamix-oficial-2",
        "status": "ok",
        "detail": "Orders 30 vs avg30 25.8 = +16.3%"
      },
      {
        "check": "volume_band_shopee-budamix-shop-3",
        "status": "ok",
        "detail": "Orders 20 vs avg30 22.4 = -10.7%"
      },
      {
        "check": "volume_band_mercado-livre",
        "status": "ok",
        "detail": "Orders 108 vs avg30 100.4 = +7.6%"
      },
      {
        "check": "volume_band_amazon",
        "status": "ok",
        "detail": "Orders 38 vs avg30 32.5 = +16.9%"
      },
      {
        "check": "reconciliation_shopee-budamix-store",
        "status": "ok",
        "detail": "Reconciliation OK"
      },
      {
        "check": "reconciliation_shopee-budamix-oficial-2",
        "status": "ok",
        "detail": "Reconciliation OK"
      },
      {
        "check": "reconciliation_shopee-budamix-shop-3",
        "status": "ok",
        "detail": "Reconciliation OK"
      },
      {
        "check": "reconciliation_mercado-livre",
        "status": "ok",
        "detail": "Reconciliation OK"
      },
      {
        "check": "reconciliation_amazon",
        "status": "ok",
        "detail": "Reconciliation OK"
      },
      {
        "check": "product_identity_contract",
        "status": "ok",
        "detail": "Top products mapped to sellable variation + short name"
      },
      {
        "check": "amazon_product_identity",
        "status": "ok",
        "detail": "Top 5 products identity check: all identified"
      },
      {
        "check": "sync_freshness",
        "status": "not_measured",
        "detail": "Sync freshness metric not available from current database schema. Registered as not_measured per plan guidelines."
      }
    ]
  },
  "source_of_truth": {
    "canonical": "Supabase orders em janela BRT, cancelados excluidos dos totais validos",
    "amazon_products": "orders.items: platform_item_id/ASIN + titulo real do pedido",
    "shopee_accounts": "orders.shop_id"
  },
  "canonical_by_platform": {
    "ml": {
      "platform": "ml",
      "order_count": 108,
      "total_revenue": 5127.39,
      "avg_order_value": 47.48
    },
    "shopee": {
      "platform": "shopee",
      "order_count": 122,
      "total_revenue": 5890.57,
      "avg_order_value": 48.28
    },
    "amazon": {
      "platform": "amazon",
      "order_count": 38,
      "total_revenue": 1328.0,
      "avg_order_value": 34.95
    }
  },
  "platforms": {
    "shopee-budamix-store": {
      "account_slug": "shopee-budamix-store",
      "account_name": "Shopee — Budamix Store",
      "platform": "shopee",
      "responsavel": "Lucas",
      "ads_owner": "Himmel",
      "filter": {
        "shop_id": "448649947"
      },
      "metrics": {
        "pedidos_validos": 72,
        "cancelamentos": 1,
        "gmv": 2816.46,
        "ticket_medio": 39.12,
        "itens_vendidos": 74,
        "top_products": [
          {
            "sku": "IMB501P",
            "raw_sku": "IMB501P_T",
            "raw_title": "Conjunto de 5 Potes de Vidro Redondos – Ideal para Alimentos e Refeições",
            "family": "IMB501",
            "parent_family": "IMB501",
            "variation": "IMB501P",
            "variation_sku": "IMB501P",
            "mapped_variation_sku": "IMB501P",
            "display_name": "Conjunto 5 Potes de Vidro Redondos Tampa Preta",
            "short_product_name": "Conjunto 5 Potes de Vidro Redondos Tampa Preta",
            "confidence": "high",
            "mapping_status": "mapped",
            "mapping_reason": "sku_alias_high_confidence",
            "source_signals": {
              "has_raw_sku": true,
              "has_title": true,
              "has_platform_item_id": true,
              "sku_normalized": "IMB501P"
            },
            "raw_skus": [
              "IMB501P_T"
            ],
            "platform_item_id": "22393168887",
            "title": "Conjunto de 5 Potes de Vidro Redondos – Ideal para Alimentos e Refeições",
            "display_short": "Conjunto de 5 Potes de Vidro Redondos – Ideal para Alimentos e Refeições",
            "slack_short_name": "Potes Vidro 5 Peças — Tampa Preta",
            "confirmed_variation_attributes": [
              "Tampa Preta"
            ],
            "orders": 40,
            "quantity": 41,
            "aggregation_level": "variation"
          },
          {
            "sku": "CK4742",
            "raw_sku": "CK4742_B",
            "raw_title": "Jarra Medidora De Vidro 500ml com Alça Para Receitas Resistente",
            "family": "CK",
            "parent_family": "CK",
            "variation": "CK4742",
            "variation_sku": "CK4742",
            "mapped_variation_sku": "CK4742",
            "display_name": "Jarra Medidora de Vidro 500ml",
            "short_product_name": "Jarra Medidora de Vidro 500ml",
            "confidence": "high",
            "mapping_status": "mapped",
            "mapping_reason": "reviewed_sku_display_map",
            "source_signals": {
              "has_raw_sku": true,
              "has_title": true,
              "has_platform_item_id": true,
              "sku_normalized": "CK4742"
            },
            "raw_skus": [
              "CK4742_B"
            ],
            "platform_item_id": "23993264258",
            "title": "Jarra Medidora De Vidro 500ml com Alça Para Receitas Resistente",
            "display_short": "Jarra Medidora de Vidro 500ml com Alça Para Receitas Resistente",
            "slack_short_name": "Jarra Medidora 500ml",
            "confirmed_variation_attributes": [],
            "orders": 16,
            "quantity": 16,
            "aggregation_level": "variation"
          },
          {
            "sku": "CTL002",
            "raw_sku": "CTL002",
            "raw_title": "Jogo com 6 Canecas Tulipa 250ml Porcelana Colorida para Mesa e Cozinha",
            "family": "CTL",
            "parent_family": "CTL",
            "variation": "CTL002",
            "variation_sku": "CTL002",
            "mapped_variation_sku": "CTL002",
            "display_name": "Kit 6 Canecas Tulipa 250ml",
            "short_product_name": "Kit 6 Canecas Tulipa 250ml",
            "confidence": "high",
            "mapping_status": "mapped",
            "mapping_reason": "reviewed_sku_display_map",
            "source_signals": {
              "has_raw_sku": true,
              "has_title": true,
              "has_platform_item_id": true,
              "sku_normalized": "CTL002"
            },
            "raw_skus": [
              "CTL002"
            ],
            "platform_item_id": "45554989236",
            "title": "Jogo com 6 Canecas Tulipa 250ml Porcelana Colorida para Mesa e Cozinha",
            "display_short": "Jogo com 6 Canecas Tulipa 250ml Porcelana Colorida para Mesa e Cozinha",
            "slack_short_name": null,
            "confirmed_variation_attributes": [],
            "orders": 6,
            "quantity": 7,
            "aggregation_level": "variation"
          },
          {
            "sku": "KIT2YW520SQ",
            "raw_sku": "KIT2YW520SQ",
            "raw_title": "Kit 2 Potes Vidro 520ml Quadrado Hermético Marmita Fitness 4 Travas Vedação",
            "family": "KIT2YW520SQ",
            "parent_family": "KIT2YW520SQ",
            "variation": "KIT2YW520SQ",
            "variation_sku": "KIT2YW520SQ",
            "mapped_variation_sku": "KIT2YW520SQ",
            "display_name": "Pote de Vidro Hermético 520ml Tampa 4 Travas",
            "short_product_name": "Pote de Vidro Hermético 520ml Tampa 4 Travas",
            "confidence": "high",
            "mapping_status": "mapped",
            "mapping_reason": "reviewed_sku_display_map",
            "source_signals": {
              "has_raw_sku": true,
              "has_title": true,
              "has_platform_item_id": true,
              "sku_normalized": "KIT2YW520SQ"
            },
            "raw_skus": [
              "KIT2YW520SQ"
            ],
            "platform_item_id": "21598077573",
            "title": "Kit 2 Potes Vidro 520ml Quadrado Hermético Marmita Fitness 4 Travas Vedação",
            "display_short": "Kit 2 Potes Vidro 520ml Quadrado Hermético Fitness",
            "slack_short_name": "Pote Vidro 520ml — Quadrado",
            "confirmed_variation_attributes": [],
            "orders": 3,
            "quantity": 3,
            "aggregation_level": "variation"
          },
          {
            "sku": "KIT6S097",
            "raw_sku": "KIT6S097",
            "raw_title": "Kit com 6 Potes de Vidro Quadrados Herméticos, Vedação e 4 Travas na Tampa",
            "family": "KIT6S",
            "parent_family": "KIT6S",
            "variation": "KIT6S097",
            "variation_sku": "KIT6S097",
            "mapped_variation_sku": "KIT6S097",
            "display_name": "Kit 6 Potes de Vidro Hermético",